{
  "catalog_version": "fossil.property-catalog.v1",
  "architecture_ref": "ARCHITECTURE.md",
  "issue_ref": "#176",
  "properties": [
    {
      "property_id": "FOSSIL-PROP-ARCH-BOUNDARY-001",
      "statement": "Domain code remains independent of adapters/providers, application code uses established ports instead of concrete providers, and first-party package cycles are rejected.",
      "criticality": "high",
      "semantic_owner": "architecture",
      "modules": ["src/fossil_core/domain", "src/fossil_core/application", "src/fossil_core/ports", "src/fossil_core/adapters"],
      "deterministic_oracles": ["tests/test_architecture_boundaries.py"],
      "property_oracles": [],
      "mutation_scope": ["scripts/check_architecture_boundaries.py"],
      "tla_refs": [],
      "lean_refs": [],
      "hidden_acceptance_required": false,
      "status": "active",
      "source_refs": ["ARCHITECTURE.md", "docs/architecture/modularization-phase0.md"]
    },
    {
      "property_id": "FOSSIL-PROP-CITATION-INTEGRITY-001",
      "statement": "A citation resolves to the intended immutable source snapshot and artifact, and any bounded passage hash matches the exact cited bytes.",
      "criticality": "critical",
      "semantic_owner": "source/citation integrity",
      "modules": ["src/fossil_core/source.py"],
      "deterministic_oracles": ["tests/test_source_provenance.py"],
      "property_oracles": ["tests/test_source_citation_properties.py"],
      "mutation_scope": ["src/fossil_core/source.py"],
      "tla_refs": [],
      "lean_refs": [],
      "hidden_acceptance_required": true,
      "status": "active",
      "source_refs": ["ARCHITECTURE.md"]
    },
    {
      "property_id": "FOSSIL-PROP-HISTORY-001",
      "statement": "Earlier claim and relation states, disagreement, and supersession remain reconstructable after later knowledge changes.",
      "criticality": "critical",
      "semantic_owner": "domain lifecycle",
      "modules": ["src/fossil_core/domain/lifecycle.py"],
      "deterministic_oracles": ["tests/test_lifecycle.py", "tests/test_temporal_benchmark.py"],
      "property_oracles": ["tests/test_lifecycle_properties.py"],
      "mutation_scope": ["src/fossil_core/domain/lifecycle.py"],
      "tla_refs": [],
      "lean_refs": ["formal/lean/Fossil/Lifecycle.lean::append_history_preserves_prior_states"],
      "hidden_acceptance_required": false,
      "status": "active",
      "source_refs": ["ARCHITECTURE.md"],
      "notes": "Lean 4.30.0 checks the named Lifecycle theorem with no sorry/admit placeholders; this formal theorem is semantic-kernel evidence, not proof of the Python implementation."
    },
    {
      "property_id": "FOSSIL-PROP-IDEMPOTENCY-001",
      "statement": "One logical retryable operation maps to a stable event identity; byte-identical replay is idempotent and conflicting content under the same stable identity fails loudly.",
      "criticality": "critical",
      "semantic_owner": "durable event identity/storage",
      "modules": ["src/fossil_core/domain/identity.py", "src/fossil_core/adapters/filesystem/event_store.py", "src/fossil_core/adapters/s3/storage.py"],
      "deterministic_oracles": ["tests/test_event_store.py", "tests/test_s3_storage_adapter.py"],
      "property_oracles": ["tests/test_identity_properties.py", "tests/test_storage_contract_properties.py"],
      "mutation_scope": ["src/fossil_core/domain/identity.py", "src/fossil_core/adapters/filesystem/event_store.py", "src/fossil_core/adapters/s3/storage.py"],
      "tla_refs": ["formal/tla/DurableStore.tla::ImmutableFirstValue"],
      "lean_refs": [],
      "hidden_acceptance_required": false,
      "status": "active",
      "source_refs": ["ARCHITECTURE.md"],
      "notes": "Bounded DurableStore TLA+ model checks immutable first-value behavior across create/replay/conflict interleavings; this is protocol-model evidence, not proof of the Python implementation."
    },
    {
      "property_id": "FOSSIL-PROP-LIFECYCLE-DEPENDENCY-001",
      "statement": "Superseding a premise marks active nonterminal claims that depend on it stale pending review without reviving terminal dependents.",
      "criticality": "high",
      "semantic_owner": "domain lifecycle",
      "modules": ["src/fossil_core/domain/lifecycle.py"],
      "deterministic_oracles": ["tests/test_lifecycle.py"],
      "property_oracles": ["tests/test_lifecycle_properties.py"],
      "mutation_scope": ["src/fossil_core/domain/lifecycle.py"],
      "tla_refs": [],
      "lean_refs": ["formal/lean/Fossil/Lifecycle.lean::terminal_dependent_is_preserved", "formal/lean/Fossil/Lifecycle.lean::nonterminal_dependent_becomes_stale", "formal/lean/Fossil/Lifecycle.lean::superseding_premise_does_not_revive_terminal_dependent"],
      "hidden_acceptance_required": false,
      "status": "active",
      "source_refs": ["ARCHITECTURE.md"],
      "notes": "Lean 4.30.0 checks the named Lifecycle dependency theorems with no sorry/admit placeholders; this formal theorem evidence does not prove the Python implementation."
    },
    {
      "property_id": "FOSSIL-PROP-PACK-ISOLATION-001",
      "statement": "Corpus reads are limited to explicitly mounted packs and writes to explicit write targets; retrievers, context providers, models, and adapters cannot widen caller authority.",
      "criticality": "critical",
      "semantic_owner": "pack access / agent query boundary",
      "modules": ["src/fossil_core/domain/pack.py", "src/fossil_core/agent.py", "src/fossil_core/application/query/security.py"],
      "deterministic_oracles": ["tests/test_pack.py", "tests/test_agent_boundary.py", "tests/test_context_security.py"],
      "property_oracles": ["tests/test_agent_query_composition_properties.py", "tests/test_pack_properties.py"],
      "mutation_scope": ["src/fossil_core/domain/pack.py", "src/fossil_core/agent.py", "src/fossil_core/application/query/security.py"],
      "tla_refs": [],
      "lean_refs": ["formal/lean/Fossil/PackAccess.lean::requested_scope_cannot_widen_mounts", "formal/lean/Fossil/PackAccess.lean::requested_scope_cannot_add_unrequested_pack", "formal/lean/Fossil/PackAccess.lean::returned_scope_preserves_mount_authority", "formal/lean/Fossil/PackAccess.lean::returned_scope_preserves_request_authority"],
      "hidden_acceptance_required": true,
      "status": "active",
      "source_refs": ["ARCHITECTURE.md"],
      "notes": "Lean 4.30.0 checks the named PackAccess authority-subset theorems with no sorry/admit placeholders. Composed runtime scope remains exercised through executable CorpusService oracles; Lean evidence does not prove the Python implementation."
    },
    {
      "property_id": "FOSSIL-PROP-PACK-MANIFEST-001",
      "statement": "A pack can read itself, every write target is readable, and every required dependency is mounted and available in a validated pack set.",
      "criticality": "high",
      "semantic_owner": "application ingest pack validation",
      "modules": ["src/fossil_core/application/ingest/pack_validation.py"],
      "deterministic_oracles": ["tests/test_pack_fixture.py", "tests/test_pack_validation_application_compatibility.py"],
      "property_oracles": ["tests/test_pack_properties.py"],
      "mutation_scope": ["src/fossil_core/application/ingest/pack_validation.py"],
      "tla_refs": [],
      "lean_refs": ["formal/lean/Fossil/PackAccess.lean::write_authority_implies_read_authority"],
      "hidden_acceptance_required": false,
      "status": "active",
      "source_refs": ["ARCHITECTURE.md", "schemas/knowledge-pack/v1.schema.json"],
      "notes": "Lean 4.30.0 checks write-authority-implies-read-authority. Dependency-cycle and exact pack-set lock semantics remain owned by #111 and are not asserted by the theorem."
    },
    {
      "property_id": "FOSSIL-PROP-PROJECTION-NONAUTHORITY-001",
      "statement": "Projection state is replaceable operational state and cannot create, delete, or confer canonical knowledge authority.",
      "criticality": "critical",
      "semantic_owner": "projection boundary",
      "modules": ["src/fossil_core/projection", "src/fossil_core/ports/projection.py"],
      "deterministic_oracles": ["tests/test_graphiti_projection.py", "tests/test_projection_migration.py"],
      "property_oracles": [],
      "mutation_scope": ["src/fossil_core/projection"],
      "tla_refs": ["formal/tla/ProjectionLifecycle.tla::ProjectionCannotManufactureAuthority"],
      "lean_refs": [],
      "hidden_acceptance_required": false,
      "status": "active",
      "source_refs": ["ARCHITECTURE.md"],
      "notes": "Bounded ProjectionLifecycle TLA+ model checks that projection slots remain subsets of durable events; this is protocol-model evidence, not proof of the Python implementation."
    },
    {
      "property_id": "FOSSIL-PROP-PROMOTION-001",
      "statement": "Cross-pack promotion is explicit, requires different source and target packs, and records a new target-pack event rather than silently mutating the source pack.",
      "criticality": "high",
      "semantic_owner": "domain promotion",
      "modules": ["src/fossil_core/domain/promotion.py"],
      "deterministic_oracles": ["tests/test_promotion.py", "tests/test_agent_boundary.py"],
      "property_oracles": [],
      "mutation_scope": ["src/fossil_core/domain/promotion.py"],
      "tla_refs": [],
      "lean_refs": ["formal/lean/Fossil/Promotion.lean"],
      "hidden_acceptance_required": false,
      "status": "active",
      "source_refs": ["ARCHITECTURE.md"],
      "notes": "Final source-revision/event pinning law is intentionally deferred to #111 before Lean proof work."
    },
    {
      "property_id": "FOSSIL-PROP-PROVENANCE-001",
      "statement": "Accepted derived knowledge retains resolvable provenance/evidence; proposed or unsourced knowledge remains explicitly distinguishable rather than masquerading as sourced truth.",
      "criticality": "critical",
      "semantic_owner": "evidence/provenance and commit boundary",